{
  "ontology_version": "0.2",
  "concepts": [
    {
      "id": "genre",
      "facet": "genre",
      "parent_id": null,
      "aliases": [],
      "deprecated_by": null
    },
    {
      "id": "genre.4x",
      "facet": "genre",
      "parent_id": "genre",
      "aliases": [
        "4x"
      ],
      "deprecated_by": null
    },
    {
      "id": "genre.action",
      "facet": "genre",
      "parent_id": "genre",
      "aliases": [
        "action"
      ],
      "deprecated_by": null
    },
    {
      "id": "genre.action-rpg",
      "facet": "genre",
      "parent_id": "genre",
      "aliases": [
        "action-rpg"
      ],
      "deprecated_by": null
    },
    {
      "id": "genre.adventure",
      "facet": "genre",
      "parent_id": "genre",
      "aliases": [
        "adventure"
      ],
      "deprecated_by": null
    },
    {
      "id": "genre.animation",
      "facet": "genre",
      "parent_id": "genre",
      "aliases": [
        "animation"
      ],
      "deprecated_by": null
    },
    {
      "id": "genre.arcade",
      "facet": "genre",
      "parent_id": "genre",
      "aliases": [
        "arcade"
      ],
      "deprecated_by": null
    },
    {
      "id": "genre.automation",
      "facet": "genre",
      "parent_id": "genre",
      "aliases": [
        "automation"
      ],
      "deprecated_by": null
    },
    {
      "id": "genre.board-game",
      "facet": "genre",
      "parent_id": "genre",
      "aliases": [
        "board-game"
      ],
      "deprecated_by": null
    },
    {
      "id": "genre.boating",
      "facet": "genre",
      "parent_id": "genre",
      "aliases": [
        "boating"
      ],
      "deprecated_by": null
    },
    {
      "id": "genre.builder",
      "facet": "genre",
      "parent_id": "genre",
      "aliases": [
        "builder"
      ],
      "deprecated_by": null
    },
    {
      "id": "genre.building",
      "facet": "genre",
      "parent_id": "genre",
      "aliases": [
        "building"
      ],
      "deprecated_by": null
    },
    {
      "id": "genre.city-builder",
      "facet": "genre",
      "parent_id": "genre",
      "aliases": [
        "city-builder"
      ],
      "deprecated_by": null
    },
    {
      "id": "genre.city-building",
      "facet": "genre",
      "parent_id": "genre",
      "aliases": [
        "city-building"
      ],
      "deprecated_by": null
    },
    {
      "id": "genre.colony-management",
      "facet": "genre",
      "parent_id": "genre",
      "aliases": [
        "colony-management"
      ],
      "deprecated_by": null
    },
    {
      "id": "genre.crafting",
      "facet": "genre",
      "parent_id": "genre",
      "aliases": [
        "crafting"
      ],
      "deprecated_by": null
    },
    {
      "id": "genre.driving",
      "facet": "genre",
      "parent_id": "genre",
      "aliases": [
        "driving"
      ],
      "deprecated_by": null
    },
    {
      "id": "genre.dungeon",
      "facet": "genre",
      "parent_id": "genre",
      "aliases": [
        "dungeon"
      ],
      "deprecated_by": null
    },
    {
      "id": "genre.dungeon-crawler",
      "facet": "genre",
      "parent_id": "genre",
      "aliases": [
        "dungeon-crawler"
      ],
      "deprecated_by": null
    },
    {
      "id": "genre.economy",
      "facet": "genre",
      "parent_id": "genre",
      "aliases": [
        "economy"
      ],
      "deprecated_by": null
    },
    {
      "id": "genre.endless-runner",
      "facet": "genre",
      "parent_id": "genre",
      "aliases": [
        "endless-runner"
      ],
      "deprecated_by": null
    },
    {
      "id": "genre.exploration",
      "facet": "genre",
      "parent_id": "genre",
      "aliases": [
        "exploration"
      ],
      "deprecated_by": null
    },
    {
      "id": "genre.fantasy",
      "facet": "genre",
      "parent_id": "genre",
      "aliases": [
        "fantasy"
      ],
      "deprecated_by": null
    },
    {
      "id": "genre.first-person-shooter",
      "facet": "genre",
      "parent_id": "genre",
      "aliases": [
        "first-person-shooter"
      ],
      "deprecated_by": null
    },
    {
      "id": "genre.flight",
      "facet": "genre",
      "parent_id": "genre",
      "aliases": [
        "flight"
      ],
      "deprecated_by": null
    },
    {
      "id": "genre.incremental",
      "facet": "genre",
      "parent_id": "genre",
      "aliases": [
        "incremental"
      ],
      "deprecated_by": null
    },
    {
      "id": "genre.management",
      "facet": "genre",
      "parent_id": "genre",
      "aliases": [
        "management"
      ],
      "deprecated_by": null
    },
    {
      "id": "genre.multiplayer",
      "facet": "genre",
      "parent_id": "genre",
      "aliases": [
        "multiplayer"
      ],
      "deprecated_by": null
    },
    {
      "id": "genre.navigation",
      "facet": "genre",
      "parent_id": "genre",
      "aliases": [
        "navigation"
      ],
      "deprecated_by": null
    },
    {
      "id": "genre.navigation-demo",
      "facet": "genre",
      "parent_id": "genre",
      "aliases": [
        "navigation-demo"
      ],
      "deprecated_by": null
    },
    {
      "id": "genre.party",
      "facet": "genre",
      "parent_id": "genre",
      "aliases": [
        "party"
      ],
      "deprecated_by": null
    },
    {
      "id": "genre.physics",
      "facet": "genre",
      "parent_id": "genre",
      "aliases": [
        "physics"
      ],
      "deprecated_by": null
    },
    {
      "id": "genre.physics-puzzle",
      "facet": "genre",
      "parent_id": "genre",
      "aliases": [
        "physics-puzzle"
      ],
      "deprecated_by": null
    },
    {
      "id": "genre.platformer",
      "facet": "genre",
      "parent_id": "genre",
      "aliases": [
        "platformer"
      ],
      "deprecated_by": null
    },
    {
      "id": "genre.procedural-generation",
      "facet": "genre",
      "parent_id": "genre",
      "aliases": [
        "procedural-generation"
      ],
      "deprecated_by": null
    },
    {
      "id": "genre.puzzle",
      "facet": "genre",
      "parent_id": "genre",
      "aliases": [
        "puzzle"
      ],
      "deprecated_by": null
    },
    {
      "id": "genre.racing",
      "facet": "genre",
      "parent_id": "genre",
      "aliases": [
        "racing"
      ],
      "deprecated_by": null
    },
    {
      "id": "genre.rendering",
      "facet": "genre",
      "parent_id": "genre",
      "aliases": [
        "rendering"
      ],
      "deprecated_by": null
    },
    {
      "id": "genre.resource-management",
      "facet": "genre",
      "parent_id": "genre",
      "aliases": [
        "resource-management"
      ],
      "deprecated_by": null
    },
    {
      "id": "genre.roguelike",
      "facet": "genre",
      "parent_id": "genre",
      "aliases": [
        "roguelike"
      ],
      "deprecated_by": null
    },
    {
      "id": "genre.rpg",
      "facet": "genre",
      "parent_id": "genre",
      "aliases": [
        "rpg"
      ],
      "deprecated_by": null
    },
    {
      "id": "genre.rts",
      "facet": "genre",
      "parent_id": "genre",
      "aliases": [
        "rts"
      ],
      "deprecated_by": null
    },
    {
      "id": "genre.sandbox",
      "facet": "genre",
      "parent_id": "genre",
      "aliases": [
        "sandbox"
      ],
      "deprecated_by": null
    },
    {
      "id": "genre.shooter",
      "facet": "genre",
      "parent_id": "genre",
      "aliases": [
        "shooter"
      ],
      "deprecated_by": null
    },
    {
      "id": "genre.simulation",
      "facet": "genre",
      "parent_id": "genre",
      "aliases": [
        "simulation"
      ],
      "deprecated_by": null
    },
    {
      "id": "genre.space",
      "facet": "genre",
      "parent_id": "genre",
      "aliases": [
        "space"
      ],
      "deprecated_by": null
    },
    {
      "id": "genre.spatial-query",
      "facet": "genre",
      "parent_id": "genre",
      "aliases": [
        "spatial-query"
      ],
      "deprecated_by": null
    },
    {
      "id": "genre.strategy",
      "facet": "genre",
      "parent_id": "genre",
      "aliases": [
        "strategy"
      ],
      "deprecated_by": null
    },
    {
      "id": "genre.strategy-toolkit",
      "facet": "genre",
      "parent_id": "genre",
      "aliases": [
        "strategy-toolkit"
      ],
      "deprecated_by": null
    },
    {
      "id": "genre.survival",
      "facet": "genre",
      "parent_id": "genre",
      "aliases": [
        "survival"
      ],
      "deprecated_by": null
    },
    {
      "id": "genre.survival-horror",
      "facet": "genre",
      "parent_id": "genre",
      "aliases": [
        "survival-horror"
      ],
      "deprecated_by": null
    },
    {
      "id": "genre.tactics",
      "facet": "genre",
      "parent_id": "genre",
      "aliases": [
        "tactics"
      ],
      "deprecated_by": null
    },
    {
      "id": "genre.tower-defense",
      "facet": "genre",
      "parent_id": "genre",
      "aliases": [
        "tower-defense"
      ],
      "deprecated_by": null
    },
    {
      "id": "genre.trading",
      "facet": "genre",
      "parent_id": "genre",
      "aliases": [
        "trading"
      ],
      "deprecated_by": null
    },
    {
      "id": "genre.transport",
      "facet": "genre",
      "parent_id": "genre",
      "aliases": [
        "transport"
      ],
      "deprecated_by": null
    },
    {
      "id": "genre.turn-based",
      "facet": "genre",
      "parent_id": "genre",
      "aliases": [
        "turn-based"
      ],
      "deprecated_by": null
    },
    {
      "id": "genre.turn-based-strategy",
      "facet": "genre",
      "parent_id": "genre",
      "aliases": [
        "turn-based-strategy"
      ],
      "deprecated_by": null
    },
    {
      "id": "genre.tycoon",
      "facet": "genre",
      "parent_id": "genre",